{
  "meet_id": "2024-11-16",
  "date": "2024-11-16",
  "name": "November 2024 meet",
  "bodyweight_kg": 90.0,
  "total_kg": 412.5,
  "dots": 266.72,
  "attempts": [
    {
      "lift": "squat",
      "attempt_no": 1,
      "weight_kg": 112.5,
      "made": true
    },
    {
      "lift": "squat",
      "attempt_no": 2,
      "weight_kg": 120,
      "made": true
    },
    {
      "lift": "squat",
      "attempt_no": 3,
      "weight_kg": 125,
      "made": true
    },
    {
      "lift": "bench",
      "attempt_no": 1,
      "weight_kg": 95,
      "made": true
    },
    {
      "lift": "bench",
      "attempt_no": 2,
      "weight_kg": 100,
      "made": true
    },
    {
      "lift": "bench",
      "attempt_no": 3,
      "weight_kg": 105,
      "made": true
    },
    {
      "lift": "deadlift",
      "attempt_no": 1,
      "weight_kg": 165,
      "made": true
    },
    {
      "lift": "deadlift",
      "attempt_no": 2,
      "weight_kg": 172.5,
      "made": true
    },
    {
      "lift": "deadlift",
      "attempt_no": 3,
      "weight_kg": 182.5,
      "made": true
    }
  ],
  "notes": "Nine for nine."
}
