{
  "meet_id": "2024-04-06",
  "date": "2024-04-06",
  "name": "April 2024 meet",
  "bodyweight_kg": 91.0,
  "total_kg": 387.5,
  "dots": 249.18,
  "attempts": [
    {
      "lift": "squat",
      "attempt_no": 1,
      "weight_kg": 107.5,
      "made": false
    },
    {
      "lift": "squat",
      "attempt_no": 2,
      "weight_kg": 112.5,
      "made": true
    },
    {
      "lift": "squat",
      "attempt_no": 3,
      "weight_kg": 117.5,
      "made": true
    },
    {
      "lift": "bench",
      "attempt_no": 1,
      "weight_kg": 100,
      "made": false
    },
    {
      "lift": "bench",
      "attempt_no": 2,
      "weight_kg": 100,
      "made": true
    },
    {
      "lift": "bench",
      "attempt_no": 3,
      "weight_kg": 105,
      "made": false
    },
    {
      "lift": "deadlift",
      "attempt_no": 1,
      "weight_kg": 155,
      "made": true
    },
    {
      "lift": "deadlift",
      "attempt_no": 2,
      "weight_kg": 165,
      "made": true
    },
    {
      "lift": "deadlift",
      "attempt_no": 3,
      "weight_kg": 170,
      "made": true
    }
  ]
}
